CourseID,Title,Type,Description,Level,Duration,Rating,Review Count,Skills Covered,Prerequisites,Affiliates,Price,Subscribers,Lectures,Published Date,URL
CID92842,Merging DataFrames with pandas,python,"This course is all about the act of combining, or merging, DataFrames, an essential part your Data Scientist's toolbox.",Unknown,Unknown,Unknown,Unknown,Unknown,Unknown,Unknown,Unknown,Unknown,Unknown,Unknown,https://www.datacamp.com//courses/merging-dataframes-with-pandas
CID34927,Bond Valuation and Analysis in R,r,Learn to use R to develop models to evaluate and analyze bonds as well as protect them from interest rate changes.,Unknown,Unknown,Unknown,Unknown,Unknown,Unknown,Unknown,Unknown,Unknown,Unknown,Unknown,https://www.datacamp.com//courses/bond-valuation-and-analysis-in-r
CID52377,Foundations of Inference in R,r,Learn how to draw conclusions about a population from a sample of data via a process known as statistical inference.,Unknown,Unknown,Unknown,Unknown,Unknown,Unknown,Unknown,Unknown,Unknown,Unknown,Unknown,https://www.datacamp.com//courses/foundations-of-inference-in-r
CID95522,Introduction to Data Visualization in Python,python,Learn complex data visualization techniques using Matplotlib and seaborn.,Unknown,Unknown,Unknown,Unknown,Unknown,Unknown,Unknown,Unknown,Unknown,Unknown,Unknown,https://www.datacamp.com//courses/introduction-to-data-visualization-in-python
CID32960,Exploratory Data Analysis in R,r,Learn how to use graphical and numerical techniques to begin uncovering the structure of your data.,Unknown,Unknown,Unknown,Unknown,Unknown,Unknown,Unknown,Unknown,Unknown,Unknown,Unknown,https://www.datacamp.com//courses/exploratory-data-analysis-in-r
CID33006,Correlation and Regression in R,r,Learn how to describe relationships between two numerical quantities and characterize these relationships graphically.,Unknown,Unknown,Unknown,Unknown,Unknown,Unknown,Unknown,Unknown,Unknown,Unknown,Unknown,https://www.datacamp.com//courses/correlation-and-regression-in-r
CID20007,Introduction to Data in R,r,"Learn the language of data, study types,  sampling strategies, and experimental design.",Unknown,Unknown,Unknown,Unknown,Unknown,Unknown,Unknown,Unknown,Unknown,Unknown,Unknown,https://www.datacamp.com//courses/introduction-to-data-in-r
CID22479,ARIMA Models in R,r,Become an expert in fitting ARIMA (autoregressive integrated moving average) models to time series data using R.,Unknown,Unknown,Unknown,Unknown,Unknown,Unknown,Unknown,Unknown,Unknown,Unknown,Unknown,https://www.datacamp.com//courses/arima-models-in-r
CID81596,Unsupervised Learning in R,r,This course provides an intro to clustering and dimensionality reduction in R from a machine learning perspective.,Unknown,Unknown,Unknown,Unknown,Unknown,Unknown,Unknown,Unknown,Unknown,Unknown,Unknown,https://www.datacamp.com//courses/unsupervised-learning-in-r
CID83544,Visualizing Geospatial Data in R,r,"Learn to read, explore, and manipulate spatial data then use your skills to create informative maps using R.",Unknown,Unknown,Unknown,Unknown,Unknown,Unknown,Unknown,Unknown,Unknown,Unknown,Unknown,https://www.datacamp.com//courses/visualizing-geospatial-data-in-r
CID60874,Introduction to Network Analysis in Python,python,"This course will equip you with the skills to analyze, visualize, and make sense of networks using the NetworkX library.",Unknown,Unknown,Unknown,Unknown,Unknown,Unknown,Unknown,Unknown,Unknown,Unknown,Unknown,https://www.datacamp.com//courses/introduction-to-network-analysis-in-python
CID54973,Supervised Learning with scikit-learn,python,Learn how to build and tune predictive models and evaluate how well they'll perform on unseen data.,Unknown,Unknown,Unknown,Unknown,Unknown,Unknown,Unknown,Unknown,Unknown,Unknown,Unknown,https://www.datacamp.com//courses/supervised-learning-with-scikit-learn
CID11503,Introduction to SQL,sql,"Master the basics of querying tables in relational databases such as MySQL, SQL Server, and PostgreSQL.",Unknown,Unknown,Unknown,Unknown,Unknown,Unknown,Unknown,Unknown,Unknown,Unknown,Unknown,https://www.datacamp.com//courses/introduction-to-sql
CID21899,Case Studies: Manipulating Time Series Data in R,r,Strengthen your knowledge of the topics covered in Manipulating Time Series in R using real case study data.,Unknown,Unknown,Unknown,Unknown,Unknown,Unknown,Unknown,Unknown,Unknown,Unknown,Unknown,https://www.datacamp.com//courses/case-studies-manipulating-time-series-data-in-r
CID19125,Introduction to Deep Learning in Python,python,Learn the fundamentals of neural networks and how to build deep learning models using Keras 2.0.,Unknown,Unknown,Unknown,Unknown,Unknown,Unknown,Unknown,Unknown,Unknown,Unknown,Unknown,https://www.datacamp.com//courses/introduction-to-deep-learning-in-python
CID50958,Object-Oriented Programming with S3 and R6 in R,r,Manage the complexity in your code using object-oriented programming with the S3 and R6 systems.,Unknown,Unknown,Unknown,Unknown,Unknown,Unknown,Unknown,Unknown,Unknown,Unknown,Unknown,https://www.datacamp.com//courses/object-oriented-programming-with-s3-and-r6-in-r
CID77934,Sentiment Analysis in R,r,"Learn sentiment analysis by identifying positive and negative language, specific emotional intent and making compelli...",Unknown,Unknown,Unknown,Unknown,Unknown,Unknown,Unknown,Unknown,Unknown,Unknown,Unknown,https://www.datacamp.com//courses/sentiment-analysis-in-r
CID27654,Cleaning Data in Python,python,This course will equip you with all the skills you need to clean your data in Python.,Unknown,Unknown,Unknown,Unknown,Unknown,Unknown,Unknown,Unknown,Unknown,Unknown,Unknown,https://www.datacamp.com//courses/cleaning-data-in-python
CID89388,Unsupervised Learning in Python,python,"Learn how to cluster, transform, visualize, and extract insights from unlabeled datasets using scikit-learn and scipy.",Unknown,Unknown,Unknown,Unknown,Unknown,Unknown,Unknown,Unknown,Unknown,Unknown,Unknown,https://www.datacamp.com//courses/unsupervised-learning-in-python
CID45828,Visualizing Time Series Data in R,r,"Learn how to visualize time series in R, then practice with a stock-picking case study.",Unknown,Unknown,Unknown,Unknown,Unknown,Unknown,Unknown,Unknown,Unknown,Unknown,Unknown,https://www.datacamp.com//courses/visualizing-time-series-data-in-r
CID46469,Life Insurance Products Valuation in R,r,"Learn the basics of cash flow valuation, work with human mortality data and build life insurance products in R.",Unknown,Unknown,Unknown,Unknown,Unknown,Unknown,Unknown,Unknown,Unknown,Unknown,Unknown,https://www.datacamp.com//courses/life-insurance-products-valuation-in-r
CID33624,Foundations of Probability in R,r,"In this course, you'll learn about the concepts of random variables, distributions, and conditioning.",Unknown,Unknown,Unknown,Unknown,Unknown,Unknown,Unknown,Unknown,Unknown,Unknown,Unknown,https://www.datacamp.com//courses/foundations-of-probability-in-r
CID86741,Scalable Data Processing in R,r,Learn how to write scalable code for working with big data in R using the bigmemory and iotools packages.,Unknown,Unknown,Unknown,Unknown,Unknown,Unknown,Unknown,Unknown,Unknown,Unknown,Unknown,https://www.datacamp.com//courses/scalable-data-processing-in-r
CID51708,Case Study: School Budgeting with Machine Learning i...,python,Learn how to build a model to automatically classify items in a school budget.,Unknown,Unknown,Unknown,Unknown,Unknown,Unknown,Unknown,Unknown,Unknown,Unknown,Unknown,https://www.datacamp.com//courses/case-study-school-budgeting-with-machine-learning-in-python
CID78031,Introduction to R for Finance,r,Learn essential data structures such as lists and data frames and apply that knowledge directly to financial examples.,Unknown,Unknown,Unknown,Unknown,Unknown,Unknown,Unknown,Unknown,Unknown,Unknown,Unknown,https://www.datacamp.com//courses/introduction-to-r-for-finance
CID07210,Intermediate R for Finance,r,"Learn about how dates work in R, and explore the world of if statements, loops, and functions using financial examples.",Unknown,Unknown,Unknown,Unknown,Unknown,Unknown,Unknown,Unknown,Unknown,Unknown,Unknown,https://www.datacamp.com//courses/intermediate-r-for-finance
CID82274,Supervised Learning in R: Classification,r,In this course you will learn the basics of machine learning for classification.,Unknown,Unknown,Unknown,Unknown,Unknown,Unknown,Unknown,Unknown,Unknown,Unknown,Unknown,https://www.datacamp.com//courses/supervised-learning-in-r-classification
CID96841,String Manipulation with stringr in R,r,"Learn how to pull character strings apart, put them back together and use the stringr package.",Unknown,Unknown,Unknown,Unknown,Unknown,Unknown,Unknown,Unknown,Unknown,Unknown,Unknown,https://www.datacamp.com//courses/string-manipulation-with-stringr-in-r
CID85606,Writing Efficient R Code,r,"Learn to write faster R code, discover benchmarking and profiling, and unlock the secrets of parallel programming.",Unknown,Unknown,Unknown,Unknown,Unknown,Unknown,Unknown,Unknown,Unknown,Unknown,Unknown,https://www.datacamp.com//courses/writing-efficient-r-code
CID44035,Forecasting in R,r,Learn how to make predictions about the future using time series forecasting in R.,Unknown,Unknown,Unknown,Unknown,Unknown,Unknown,Unknown,Unknown,Unknown,Unknown,Unknown,https://www.datacamp.com//courses/forecasting-in-r
CID04121,Machine Learning with Tree-Based Models in R,r,"In this course, you'll learn how to use tree-based models and ensembles for regression and classification.",Unknown,Unknown,Unknown,Unknown,Unknown,Unknown,Unknown,Unknown,Unknown,Unknown,Unknown,https://www.datacamp.com//courses/machine-learning-with-tree-based-models-in-r
CID93568,Working with Web Data in R,r,Learn how to efficiently import data from the web into R.,Unknown,Unknown,Unknown,Unknown,Unknown,Unknown,Unknown,Unknown,Unknown,Unknown,Unknown,https://www.datacamp.com//courses/working-with-web-data-in-r
CID06213,Quantitative Risk Management in R,r,"Work with risk-factor return series, study their empirical properties, and make estimates of value-at-risk.",Unknown,Unknown,Unknown,Unknown,Unknown,Unknown,Unknown,Unknown,Unknown,Unknown,Unknown,https://www.datacamp.com//courses/quantitative-risk-management-in-r
CID57825,Spatial Statistics in R,r,Learn how to make sense of spatial data and deal with various classes of statistical problems associated with it.,Unknown,Unknown,Unknown,Unknown,Unknown,Unknown,Unknown,Unknown,Unknown,Unknown,Unknown,https://www.datacamp.com//courses/spatial-statistics-in-r
CID72772,Data Visualization with lattice in R,r,Learn to visualize multivariate datasets using lattice graphics.,Unknown,Unknown,Unknown,Unknown,Unknown,Unknown,Unknown,Unknown,Unknown,Unknown,Unknown,https://www.datacamp.com//courses/data-visualization-with-lattice-in-r
CID85631,Introduction to Spark with sparklyr in R,r,Learn how to analyze huge datasets using Apache Spark and R using the sparklyr package.,Unknown,Unknown,Unknown,Unknown,Unknown,Unknown,Unknown,Unknown,Unknown,Unknown,Unknown,https://www.datacamp.com//courses/introduction-to-spark-with-sparklyr-in-r
CID76113,Data Types for Data Science in Python,python,"Consolidate and extend your knowledge of Python data types such as lists, dictionaries, and tuples, leveraging them t...",Unknown,Unknown,Unknown,Unknown,Unknown,Unknown,Unknown,Unknown,Unknown,Unknown,Unknown,https://www.datacamp.com//courses/data-types-for-data-science-in-python
CID22315,Sentiment Analysis in R: The Tidy Way,r,"In this course, you will the learn principles of sentiment analysis from a tidy data perspective.",Unknown,Unknown,Unknown,Unknown,Unknown,Unknown,Unknown,Unknown,Unknown,Unknown,Unknown,https://www.datacamp.com//courses/sentiment-analysis-in-r-the-tidy-way
CID06690,Intermediate Network Analysis in Python,python,"Analyze time series graphs, use bipartite graphs, and gain the skills to tackle advanced problems in network analytics.",Unknown,Unknown,Unknown,Unknown,Unknown,Unknown,Unknown,Unknown,Unknown,Unknown,Unknown,https://www.datacamp.com//courses/intermediate-network-analysis-in-python
CID26531,Multiple and Logistic Regression in R,r,In this course you'll learn to add multiple variables to linear models and to use logistic regression for classificat...,Unknown,Unknown,Unknown,Unknown,Unknown,Unknown,Unknown,Unknown,Unknown,Unknown,Unknown,https://www.datacamp.com//courses/multiple-and-logistic-regression-in-r
CID10802,Inference for Linear Regression in R,r,In this course you'll learn how to perform inference using linear models.,Unknown,Unknown,Unknown,Unknown,Unknown,Unknown,Unknown,Unknown,Unknown,Unknown,Unknown,https://www.datacamp.com//courses/inference-for-linear-regression-in-r
CID99059,Introduction to Natural Language Processing in Python,python,Learn fundamental natural language processing techniques using Python and how to apply them to extract insights from ...,Unknown,Unknown,Unknown,Unknown,Unknown,Unknown,Unknown,Unknown,Unknown,Unknown,Unknown,https://www.datacamp.com//courses/introduction-to-natural-language-processing-in-python
CID82026,Building Chatbots in Python,python,Learn the fundamentals of how to build conversational bots using rule-based systems as well as machine learning.,Unknown,Unknown,Unknown,Unknown,Unknown,Unknown,Unknown,Unknown,Unknown,Unknown,Unknown,https://www.datacamp.com//courses/building-chatbots-in-python
CID53583,Extreme Gradient Boosting with XGBoost,python,Learn the fundamentals of gradient boosting and build state-of-the-art machine learning models using XGBoost to solve...,Unknown,Unknown,Unknown,Unknown,Unknown,Unknown,Unknown,Unknown,Unknown,Unknown,Unknown,https://www.datacamp.com//courses/extreme-gradient-boosting-with-xgboost
CID18252,Equity Valuation in R,r,Learn the fundamentals of valuing stocks.,Unknown,Unknown,Unknown,Unknown,Unknown,Unknown,Unknown,Unknown,Unknown,Unknown,Unknown,https://www.datacamp.com//courses/equity-valuation-in-r
CID95037,Case Studies: Building Web Applications with Shiny in R,r,Practice your Shiny skills while building some fun Shiny apps for real-life scenarios!,Unknown,Unknown,Unknown,Unknown,Unknown,Unknown,Unknown,Unknown,Unknown,Unknown,Unknown,https://www.datacamp.com//courses/case-studies-building-web-applications-with-shiny-in-r
CID75956,Supervised Learning in R: Regression,r,"In this course you will learn how to predict future events using linear regression, generalized additive models, rand...",Unknown,Unknown,Unknown,Unknown,Unknown,Unknown,Unknown,Unknown,Unknown,Unknown,Unknown,https://www.datacamp.com//courses/supervised-learning-in-r-regression
CID95538,Importing and Managing Financial Data in Python,python,"In this course, you'll learn how to import and manage financial data in Python using various tools and sources.",Unknown,Unknown,Unknown,Unknown,Unknown,Unknown,Unknown,Unknown,Unknown,Unknown,Unknown,https://www.datacamp.com//courses/importing-and-managing-financial-data-in-python
CID01468,Optimizing R Code with Rcpp,r,Use C++ to dramatically boost the performance of your R code.,Unknown,Unknown,Unknown,Unknown,Unknown,Unknown,Unknown,Unknown,Unknown,Unknown,Unknown,https://www.datacamp.com//courses/optimizing-r-code-with-rcpp
CID61617,Manipulating Time Series Data in Python,python,In this course you'll learn the basics of working with time series data.,Unknown,Unknown,Unknown,Unknown,Unknown,Unknown,Unknown,Unknown,Unknown,Unknown,Unknown,https://www.datacamp.com//courses/manipulating-time-series-data-in-python
CID53677,Time Series Analysis in Python,python,In this course you'll learn the basics of analyzing time series data.,Unknown,Unknown,Unknown,Unknown,Unknown,Unknown,Unknown,Unknown,Unknown,Unknown,Unknown,https://www.datacamp.com//courses/time-series-analysis-in-python
CID58464,Parallel Programming with Dask in Python,python,Learn how to take the Python workflows you currently have and easily scale them up to large datasets without the need...,Unknown,Unknown,Unknown,Unknown,Unknown,Unknown,Unknown,Unknown,Unknown,Unknown,Unknown,https://www.datacamp.com//courses/parallel-programming-with-dask-in-python
CID45138,Spatial Analysis with sf and raster in R,r,Analyze spatial data using the sf and raster packages.,Unknown,Unknown,Unknown,Unknown,Unknown,Unknown,Unknown,Unknown,Unknown,Unknown,Unknown,https://www.datacamp.com//courses/spatial-analysis-with-sf-and-raster-in-r
CID16343,Introduction to PySpark,python,"Learn to implement distributed data management and machine learning in
Spark using the PySpark package.",Unknown,Unknown,Unknown,Unknown,Unknown,Unknown,Unknown,Unknown,Unknown,Unknown,Unknown,https://www.datacamp.com//courses/introduction-to-pyspark
CID35791,Network Analysis in R,r,In this course you'll learn to analyze and visualize network data with the igraph package.,Unknown,Unknown,Unknown,Unknown,Unknown,Unknown,Unknown,Unknown,Unknown,Unknown,Unknown,https://www.datacamp.com//courses/network-analysis-in-r
CID11584,Case Studies in Statistical Thinking,python,Take vital steps towards mastery as you apply your statistical thinking skills to real-world data sets and extract ac...,Unknown,Unknown,Unknown,Unknown,Unknown,Unknown,Unknown,Unknown,Unknown,Unknown,Unknown,https://www.datacamp.com//courses/case-studies-in-statistical-thinking
CID33229,Joining Data in SQL,sql,"Join two or three tables together into one, combine tables using set theory, and work with subqueries in PostgreSQL.",Unknown,Unknown,Unknown,Unknown,Unknown,Unknown,Unknown,Unknown,Unknown,Unknown,Unknown,https://www.datacamp.com//courses/joining-data-in-postgresql
CID32585,Introduction to the Tidyverse,r,"Get started on the path to exploring and visualizing your own data with the tidyverse, a powerful and popular collect...",Unknown,Unknown,Unknown,Unknown,Unknown,Unknown,Unknown,Unknown,Unknown,Unknown,Unknown,https://www.datacamp.com//courses/introduction-to-the-tidyverse
CID28913,Introduction to Shell,shell,"The Unix command line helps users combine existing programs in new ways, automate repetitive tasks, and run programs ...",Unknown,Unknown,Unknown,Unknown,Unknown,Unknown,Unknown,Unknown,Unknown,Unknown,Unknown,https://www.datacamp.com//courses/introduction-to-shell
CID94540,Developing R Packages,r,Create and share your own R Packages!,Unknown,Unknown,Unknown,Unknown,Unknown,Unknown,Unknown,Unknown,Unknown,Unknown,Unknown,https://www.datacamp.com//courses/developing-r-packages
CID42389,Inference for Numerical Data in R,r,In this course you'll learn techniques for performing statistical inference on numerical data.,Unknown,Unknown,Unknown,Unknown,Unknown,Unknown,Unknown,Unknown,Unknown,Unknown,Unknown,https://www.datacamp.com//courses/inference-for-numerical-data-in-r
CID86113,Visualizing Time Series Data in Python,python,"Visualize seasonality, trends and other patterns in your time series data.",Unknown,Unknown,Unknown,Unknown,Unknown,Unknown,Unknown,Unknown,Unknown,Unknown,Unknown,https://www.datacamp.com//courses/visualizing-time-series-data-in-python
CID43483,Data Manipulation with data.table in R,r,"Master core concepts about data manipulation such as filtering, selecting and calculating groupwise statistics using ...",Unknown,Unknown,Unknown,Unknown,Unknown,Unknown,Unknown,Unknown,Unknown,Unknown,Unknown,https://www.datacamp.com//courses/data-manipulation-with-datatable-in-r
CID40377,Fundamentals of Bayesian Data Analysis in R,r,"Learn what Bayesian data analysis is, how it works, and why it is a useful tool to have in your data science toolbox.",Unknown,Unknown,Unknown,Unknown,Unknown,Unknown,Unknown,Unknown,Unknown,Unknown,Unknown,https://www.datacamp.com//courses/fundamentals-of-bayesian-data-analysis-in-r
CID39971,Working with Dates and Times in R,r,"Learn the essentials of parsing, manipulating and computing with dates and times in R.",Unknown,Unknown,Unknown,Unknown,Unknown,Unknown,Unknown,Unknown,Unknown,Unknown,Unknown,https://www.datacamp.com//courses/working-with-dates-and-times-in-r
CID95797,Introduction to Git,git,This course is an introduction to version control with Git for data scientists.,Unknown,Unknown,Unknown,Unknown,Unknown,Unknown,Unknown,Unknown,Unknown,Unknown,Unknown,https://www.datacamp.com//courses/introduction-to-git
CID51093,Python for R Users,python,This course is for R users who want to get up to speed with Python!,Unknown,Unknown,Unknown,Unknown,Unknown,Unknown,Unknown,Unknown,Unknown,Unknown,Unknown,https://www.datacamp.com//courses/python-for-r-users
CID39381,Cluster Analysis in R,r,Develop a strong intuition for how hierarchical and k-means clustering work and learn how to apply them to extract in...,Unknown,Unknown,Unknown,Unknown,Unknown,Unknown,Unknown,Unknown,Unknown,Unknown,Unknown,https://www.datacamp.com//courses/cluster-analysis-in-r
CID33441,Introduction to Financial Concepts in Python,python,"Using Python and NumPy, learn the most fundamental financial concepts.",Unknown,Unknown,Unknown,Unknown,Unknown,Unknown,Unknown,Unknown,Unknown,Unknown,Unknown,https://www.datacamp.com//courses/introduction-to-financial-concepts-in-python
CID94284,Introduction to Portfolio Risk Management in Python,python,"Evaluate portfolio risk and returns, construct market-cap weighted equity portfolios and learn how to forecast and he...",Unknown,Unknown,Unknown,Unknown,Unknown,Unknown,Unknown,Unknown,Unknown,Unknown,Unknown,https://www.datacamp.com//courses/introduction-to-portfolio-risk-management-in-python
CID19147,Inference for Categorical Data in R,r,In this course you'll learn how to leverage statistical techniques for working with categorical data.,Unknown,Unknown,Unknown,Unknown,Unknown,Unknown,Unknown,Unknown,Unknown,Unknown,Unknown,https://www.datacamp.com//courses/inference-for-categorical-data-in-r
CID23225,Conda Essentials,shell,Learn how to easily manage your software using conda.,Unknown,Unknown,Unknown,Unknown,Unknown,Unknown,Unknown,Unknown,Unknown,Unknown,Unknown,https://www.datacamp.com//courses/conda-essentials
CID83666,Interactive Data Visualization with plotly in R,r,Learn to create interactive graphics entirely in R with plotly.,Unknown,Unknown,Unknown,Unknown,Unknown,Unknown,Unknown,Unknown,Unknown,Unknown,Unknown,https://www.datacamp.com//courses/interactive-data-visualization-with-plotly-in-r
CID57566,Visualizing Big Data with Trelliscope,r,Learn how to visualize big data in R using ggplot2 and trelliscopejs.,Unknown,Unknown,Unknown,Unknown,Unknown,Unknown,Unknown,Unknown,Unknown,Unknown,Unknown,https://www.datacamp.com//courses/visualizing-big-data-with-trelliscope-in-r
CID67726,Building Dashboards with flexdashboard,r,In this course you'll learn how to create static and interactive dashboards using flexdashboard and shiny.,Unknown,Unknown,Unknown,Unknown,Unknown,Unknown,Unknown,Unknown,Unknown,Unknown,Unknown,https://www.datacamp.com//courses/building-dashboards-with-flexdashboard
CID84814,Communicating with Data in the Tidyverse,r,Leverage the power of tidyverse tools to create publication-quality graphics and custom-styled reports that communica...,Unknown,Unknown,Unknown,Unknown,Unknown,Unknown,Unknown,Unknown,Unknown,Unknown,Unknown,https://www.datacamp.com//courses/communicating-with-data-in-the-tidyverse
CID49463,Introduction to Linear Modeling in Python,python,"Explore the concepts and applications of linear models with python and build models to describe, predict, and extract...",Unknown,Unknown,Unknown,Unknown,Unknown,Unknown,Unknown,Unknown,Unknown,Unknown,Unknown,https://www.datacamp.com//courses/introduction-to-linear-modeling-in-python
CID53913,Introduction to MongoDB in Python,python,Learn to manipulate and analyze flexibly structured data with MongoDB.,Unknown,Unknown,Unknown,Unknown,Unknown,Unknown,Unknown,Unknown,Unknown,Unknown,Unknown,https://www.datacamp.com//courses/introduction-to-using-mongodb-for-data-science-with-python
CID30961,ChIP-seq Workflows in R,r,Learn how to analyse and interpret ChIP-seq data with the help of Bioconductor using a human cancer dataset.,Unknown,Unknown,Unknown,Unknown,Unknown,Unknown,Unknown,Unknown,Unknown,Unknown,Unknown,https://www.datacamp.com//courses/chip-seq-with-bioconductor-in-r
CID98034,Joining Data with data.table in R,r,This course will show you how to combine and merge datasets with data.table.,Unknown,Unknown,Unknown,Unknown,Unknown,Unknown,Unknown,Unknown,Unknown,Unknown,Unknown,https://www.datacamp.com//courses/joining-data-with-datatable-in-r
CID10401,Foundations of Functional Programming with purrr,r,Learn to easily summarize and manipulate lists using the purrr package.,Unknown,Unknown,Unknown,Unknown,Unknown,Unknown,Unknown,Unknown,Unknown,Unknown,Unknown,https://www.datacamp.com//courses/foundations-of-functional-programming-with-purrr
CID47881,Visualization Best Practices in R,r,"Learn to  effectively convey your data with an overview of common charts, alternative visualization types, and percep...",Unknown,Unknown,Unknown,Unknown,Unknown,Unknown,Unknown,Unknown,Unknown,Unknown,Unknown,https://www.datacamp.com//courses/visualization-best-practices-in-r
CID54865,Building Dashboards with shinydashboard,r,In this course you'll learn to build dashboards using the shinydashboard package.,Unknown,Unknown,Unknown,Unknown,Unknown,Unknown,Unknown,Unknown,Unknown,Unknown,Unknown,https://www.datacamp.com//courses/building-dashboards-with-shinydashboard
CID41937,Modeling with Data in the Tidyverse,r,Explore Linear Regression in a tidy framework.,Unknown,Unknown,Unknown,Unknown,Unknown,Unknown,Unknown,Unknown,Unknown,Unknown,Unknown,https://www.datacamp.com//courses/modeling-with-data-in-the-tidyverse
CID04504,Human Resources Analytics: Exploring Employee Data in R,r,"Manipulate, visualize, and perform statistical tests on HR data.",Unknown,Unknown,Unknown,Unknown,Unknown,Unknown,Unknown,Unknown,Unknown,Unknown,Unknown,https://www.datacamp.com//courses/human-resources-analytics-exploring-employee-data-in-r
