CourseID,Title,Type,Description,Level,Duration,Rating,Review Count,Skills Covered,Prerequisites,Affiliates,Price,Subscribers,Lectures,Published Date,URL
CID14273,Data Engineering with AWS,nanodegree,"Learn to design data models, build data warehouses and data lakes, automate data pipelines, and manage massive datasets.",intermediate,4 Months,4.6,1802.0,"AWS Glue,  Amazon S3,  AWS Data Warehouse,  Redshift,  Apache Airflow,  Data Pipeline DAGs,  Data Extraction,  Data Pipeline Creation,  ETL,  OLAP Cubes,  Data Warehouse Architecture,  Cloud Computing Fluency,  Data Pipeline Maintenance","Intermediate Python, intermediate SQL & command line",none,Unknown,Unknown,Unknown,Unknown,https://www.udacity.com/course/data-engineer-nanodegree--nd027
CID47532,Product Manager,nanodegree,"Envision and execute the development of industry-defining products, and learn how to successfully bring them to market.",beginner,4 Months,4.7,864.0,"Product Strategy, Product Design, Product Development, Design Sprint, Product Launch",No Experience Required,none,Unknown,Unknown,Unknown,Unknown,https://www.udacity.com/course/product-manager-nanodegree--nd036
CID81868,C++,nanodegree,Get hands-on experience building five real-world projects in this popular general-purpose programming language.,intermediate,4 Months,4.5,1126.0,"Data Structures & Algorithms, Memory Management, Concurrency, Object-oriented Programming, C++",Intermediate Programming,none,Unknown,Unknown,Unknown,Unknown,https://www.udacity.com/course/c-plus-plus-nanodegree--nd213
CID52419,Business Analytics,nanodegree,"Gain foundational data skills like analyzing data, modeling business scenarios, and communicating findings.",beginner,3 Months,4.8,2649.0,"Excel & Spreadsheets, SQL, Data Visualization, Data Dashboards",not specified,Mode,Unknown,Unknown,Unknown,Unknown,https://www.udacity.com/course/business-analytics-nanodegree--nd098
CID59645,Data Scientist,nanodegree,"Build effective machine learning models, run data pipelines, build recommendation systems, and deploy solutions to the cloud with industry-aligned projects.",advanced,4 Months,4.7,1212.0,"Machine Learning, Deep Learning, Software Engineering","Python, SQL & Statistics","Bertelsmann, Figure Eight, IBM Watson, Insight, Kaggle, Starbucks",Unknown,Unknown,Unknown,Unknown,https://www.udacity.com/course/data-scientist-nanodegree--nd025
CID24845,Introduction to Programming,nanodegree,"A first step for beginners towards careers in web and app development, machine learning, data science, AI, and more.",beginner,4 Months,4.7,3865.0,"Front-End Development Basics,  HTML,  CSS,  Python Syntax,  Text Processing in Python,  DevTools,  Command Line Interface Basics,  Code Debugging,  Basic JavaScript scripts,  JavaScript Functions,  JavaScript arrays,  JavaScript objects",No coding experience needed,none,Unknown,Unknown,Unknown,Unknown,https://www.udacity.com/course/intro-to-programming-nanodegree--nd000
CID21676,Digital Marketing,nanodegree,"Meet the growing demand for skilled digital marketers by learning the latest technologies for building impactful marketing strategies.
",beginner,3 Months,4.7,2418.0,"Digital Marketing,  Marketing fundamentals,  Google Analytics,  Social Media Marketing,  Facebook Marketing,  Search Engine Optimization,  Search Engine Marketing,  Digital marketing metrics,  Display Ads,  Video advertising,  Email marketing,  Branding strategy",No Experience Required.,none,Unknown,Unknown,Unknown,Unknown,https://www.udacity.com/course/digital-marketing-nanodegree--nd018
CID68855,Data Analyst,nanodegree,"Use Python, SQL, and statistics to uncover insights, communicate critical findings, and create data-driven solutions.",intermediate,4 Months,4.6,3496.0,"Data Wrangling, Matplotlib, Bootstrapping, Pandas & NumPy, Statistics",Python & SQL,Kaggle,Unknown,Unknown,Unknown,Unknown,https://www.udacity.com/course/data-analyst-nanodegree--nd002
CID45077,Deep Learning,nanodegree,Deep learning is driving advances in artificial intelligence that are changing our world—enroll now and learn to build and apply your own deep neural networks.,intermediate,4 Months,4.7,3368.0,"Neural Networks,  Perceptron,  Autoencoders,  Convolutional Neural Networks,  PyTorch,  Object Detection,  Recurrent Neural Networks,  Long-short term Memory Networks,  Backpropagation,  Generative Adversarial Networks,  Deep Learning Techniques,  Image Generation,  Hyperparameter Tuning",Intermediate Python,none,Unknown,Unknown,Unknown,Unknown,https://www.udacity.com/course/deep-learning-nanodegree--nd101
CID83178,Programming for Data Science with Python,nanodegree,"Learn the fundamental programming tools for data professionals: Python, SQL, terminal, and Git.",beginner,3 Months,4.7,1558.0,"Python, Numpy & Pandas, SQL, Git & GitHub",not specified,Mode,Unknown,Unknown,Unknown,Unknown,https://www.udacity.com/course/programming-for-data-science-nanodegree--nd104
CID77286,Full Stack Web Developer,nanodegree,"Learn to design and develop powerful modern web applications that form the foundation for the apps, websites, and systems that people and businesses use every day.",intermediate,4 Months,4.5,749.0,"Python, JavaScript, PostgreSQL, Flask, Docker, Kubernetes","Prior experience with Python, CSS/HTML, and Git",none,Unknown,Unknown,Unknown,Unknown,https://www.udacity.com/course/full-stack-web-developer-nanodegree--nd0044
CID84933,AWS Machine Learning Engineer,nanodegree,Learn the data science and machine learning skills required to build and deploy machine learning models in production using Amazon SageMaker.,intermediate,5 Months,4.7,143.0,"Feature Engineering,  Machine Learning Fluency,  Data Loading with SageMaker,  Amazon S3,  Neural Network Basics,  Deep Learning Fluency,  Hyperparameter Tuning,  Machine Learning Framework Fundamentals,  SageMaker JumpStart,  Cloud Resource Allocation,  Distributed Model Training with SageMaker,  AWS Lambda ",Basic knowledge of machine learning algorithms and Python programming,AWS,Unknown,Unknown,Unknown,Unknown,https://www.udacity.com/course/aws-machine-learning-engineer-nanodegree--nd189
CID68854,SQL,nanodegree,"Master SQL, the core language for big data analysis, to enable insight-driven decision-making and strategy.",beginner,2 Months,4.6,339.0,"SQL, PostgreSQL, JOINs, Subqueries, Window Functions, Partitions, Data Cleaning, DDL, DML, Relational and Non-Relational Databases",Basic understanding of data types,none,Unknown,Unknown,Unknown,Unknown,https://www.udacity.com/course/learn-sql--nd072
CID52105,Machine Learning DevOps Engineer,nanodegree,Gain the DevOps skills required to automate the various aspects and stages of building and monitoring machine learning models.,advanced,4 Months,4.6,115.0,"API development,  Automated model scoring,  CI/CD,  Model testing,  Data Version Control,  Machine Learning Pipelines",Prior experience with Python and Machine Learning,none,Unknown,Unknown,Unknown,Unknown,https://www.udacity.com/course/machine-learning-dev-ops-engineer-nanodegree--nd0821
CID62267,Artificial Intelligence for Trading,nanodegree,"Complete real-world projects designed by industry experts, covering topics from asset management to trading signal generation. Master AI algorithms for trading, and build your career-ready portfolio.",intermediate,6 Months,4.6,789.0,"Momentum Trading Strategy, Smart Beta, Alpha Factors, Natural Language Processing, Deep Learning, Neural Networks",Python & Mathematics,WorldQuant,Unknown,Unknown,Unknown,Unknown,https://www.udacity.com/course/ai-for-trading--nd880
CID19834,React,nanodegree,Learn to build declarative user interfaces for the web with React as well as manage state more predictably in your applications with Redux.,intermediate,2 Months,4.7,1269.0,"React Component State,  React Router,  React Hooks,  JavaScript Functions,  Application State Management with Redux,  React-Redux Bindings,  React Component State,  Fetching Data,  React Native Basics,  Data Lifecycle Management,  Jest,  React-Redux Bindings,  React Design Patterns,  Software Testing","HTML & CSS, JavaScript, Asynchronous JavaScript (AJAX) and Web forms",none,Unknown,Unknown,Unknown,Unknown,https://www.udacity.com/course/react-nanodegree--nd019
CID31768,Self-Driving Car Engineer,nanodegree,Learn the techniques that power self-driving cars across the full stack of a vehicle’s autonomous capabilities.,advanced,5 Months,2.21,715.0,"Computer Vision, Deep Learning, Sensor Fusion, Localization, Self-Driving Cars, Path Planning and Control","Python, C++, Linear Algebra and Calculus","Waymo, Mercedes-Benz",Unknown,Unknown,Unknown,Unknown,https://www.udacity.com/course/self-driving-car-engineer-nanodegree--nd0013
CID17145,UX Designer,nanodegree,Design impactful user experiences for products in today’s digital world.,beginner,3 Months,4.7,1032.0,"User Research, User Experience, Prototyping, Interactive Design, User Interface Design, Usability Testing",No Experience Required.,none,Unknown,Unknown,Unknown,Unknown,https://www.udacity.com/course/ux-designer-nanodegree--nd578
CID49478,Java Developer,nanodegree,"Learn back-end development with Java, one of the most popular programming languages in the world.",intermediate,4 Months,4.5,359.0,"Java, Spring Boot, Rest API, MySQL, MongoDB",Intermediate knowledge of Java,none,Unknown,Unknown,Unknown,Unknown,https://www.udacity.com/course/java-developer-nanodegree--nd035
CID45992,Data Engineering with Microsoft Azure ,nanodegree,Master job-ready Azure skills like designing data models and utilizing other in-demand components of the cloud computing service.,intermediate,4 Months,4.88,715.0,"Database Normalization,  Data Modeling Basics,  PostgreSQL,  SQL and SQL scripting, Denormalized Data Schemas,  Relational data modeling,  OLAP Cubes,  Data Warehouse Architecture,  Data Extraction,  Big Data Fluency,  Apache Spark,  Data Lakes,  Apache Airflow,  Azure Pipelines
","Experience with SQL, Python, Azure, and Github",none,Unknown,Unknown,Unknown,Unknown,https://www.udacity.com/course/data-engineering-with-microsoft-azure-nanodegree--nd0277
CID53563,AI Programming with Python,nanodegree,"Learn Python, NumPy, pandas, Matplotlib, PyTorch, calculus, and linear algebra—the foundations for building your own neural network.",beginner,3 Months,4.7,1626.0,"Python, NumPy, Pandas, Matplotlib, PyTorch",Basic Algebra and Programming Knowledge,none,Unknown,Unknown,Unknown,Unknown,https://www.udacity.com/course/ai-programming-python-nanodegree--nd089
CID87188,Data Product Manager,nanodegree,Apply data science best practices to build products that deliver the right experience to the right users—at the right time.,intermediate,3 Months,4.3,220.0,"Data Science, Product Management, Product Design, Data Visualization, User Journey Maps",Prior Data Analysis & Product Management Experience Recommended,none,Unknown,Unknown,Unknown,Unknown,https://www.udacity.com/course/data-product-manager-nanodegree--nd030
CID43480,Intermediate Python,nanodegree,"Learn how to plan, design, and implement enterprise data infrastructure solutions and create the blueprints for your organization’s data success.",intermediate,2 Months,4.4,144.0,"Python, Object-oriented programming, Modular code, Python Package Index",Basic Python,none,Unknown,Unknown,Unknown,Unknown,https://www.udacity.com/course/intermediate-python-nanodegree--nd303
CID70208,Growth Product Manager,nanodegree,"Lead experimentation and data-driven decision-making to drive products to the next level of scale, impact, and profitability.",intermediate,3 Months,4.5,50.0,"Acquisition Strategy,  Growth Loops,  Product Management,  Activation Metrics,  Growth Strategy,  Activation Strategy,  Product Monetization Strategy,  Product Monetization Metrics,  Premium Value,  Cohort Analysis,  Experiment Design,  Target Personas,  Customer Acquisition Cost,  User Journey Maps",Prior Product Management Experience recommended,none,Unknown,Unknown,Unknown,Unknown,https://www.udacity.com/course/growth-product-manager-nanodegree--nd037
CID93097,Front End Web Developer,nanodegree,Learn how to build high quality websites and dynamic applications to create stunning user experiences for the web.,intermediate,4 Months,4.6,1194.0,"JavaScript, HTML, CSS, Webpack, Flexbox, Node, Object-oriented Programming","Knowledge of basic HTML, CSS, and JavaScript",none,Unknown,Unknown,Unknown,Unknown,https://www.udacity.com/course/front-end-web-developer-nanodegree--nd0011
CID38127,Blockchain Developer,nanodegree,"Demand for blockchain developers is skyrocketing. In this program, you'll work with the Bitcoin and Ethereum protocols, build projects for real-world application, and gain the essential skills for a career in this dynamic space.",intermediate,4 Months,4.5,566.0,"Ethereum Blockchain, Blockchain Architecture, Data Auditing",Object-oriented programming,none,Unknown,Unknown,Unknown,Unknown,https://www.udacity.com/course/blockchain-developer-nanodegree--nd1309
CID75512,Deep Reinforcement Learning,nanodegree,Master the deep reinforcement learning skills that are powering amazing advances in AI—and start applying these skills to applications like video games and robotics.,advanced,3 Months,4.6,534.0,"Reinforcement Learning, Neural Networks, PyTorch, Deep Q-Networks (DQN), Deep Deterministic Policy Gradients (DDPG)","Experience with Python, Probability, Machine Learning, & Deep Learning.","Unity, Nvidia Deep Learning Institute",Unknown,Unknown,Unknown,Unknown,https://www.udacity.com/course/deep-reinforcement-learning-nanodegree--nd893
CID46068,Computer Vision,nanodegree,"Learn the in-demand skills of computer vision, a growing field of AI, that empower advancements in robotics and automation.",advanced,3 Months,4.7,798.0,"Convolutional Neural Networks, Recurrent Neural Networks, Simultaneous Localization and Mapping, Object Tracking, Image Classification, Deep Learning","Python, Statistics, Machine Learning, & Deep Learning","Affectiva, Nvidia Deep Learning Institute",Unknown,Unknown,Unknown,Unknown,https://www.udacity.com/course/computer-vision-nanodegree--nd891
CID63362,Data Structures and Algorithms,nanodegree,Get hands-on practice with over 100 data structures and algorithm exercises with technical mentor support when needed to help prepare you for the workplace.,intermediate,4 Months,4.7,850.0,"Data Structures and Algorithms, Problem Solving, Interview Practice Problems, Python",Python and Basic Algebra,none,Unknown,Unknown,Unknown,Unknown,https://www.udacity.com/course/data-structures-and-algorithms-nanodegree--nd256
CID69543,Robotics Software Engineer,nanodegree,"Build five hands-on projects to acquire core robotics software engineering skills: ROS, Gazebo, localization, mapping, SLAM, navigation, and path planning.",advanced,4 Months,4.5,571.0,"C++, ROS, Localization, Mapping, SLAM, Navigation, Path Planning, Robot Operating System, Robotics",Mathematics & Programming,none,Unknown,Unknown,Unknown,Unknown,https://www.udacity.com/course/robotics-software-engineer--nd209
CID78871,AI Product Manager,nanodegree,Develop AI products that deliver real business value by building skills that help you compete in the new AI-powered world.,beginner,2 Months,4.4,616.0,"AI Products, Training ML Models, Annotating Datasets, Prototyping a Product",No Experience Required,Appen,Unknown,Unknown,Unknown,Unknown,https://www.udacity.com/course/ai-product-manager-nanodegree--nd088
CID24035,Android Kotlin Developer,nanodegree,"Master Android app development with Kotlin, a modern programming language that enables developers to be more productive.",intermediate,4 Months,4.7,355.0,"Android Development, Kotlin, Android Studio, Gradle, RESTful interfaces, Web APIs, App Architecture, Databases, Custom Views, Notifications, Location Services, Testing, Firebase",Experience with Object-Oriented Programming,Google,Unknown,Unknown,Unknown,Unknown,https://www.udacity.com/course/android-kotlin-developer-nanodegree--nd940
CID52320,Java Programming,nanodegree,"Elevate your Java abilities with the fundamental skills used by developers to design, code, test, and deploy cutting-edge Java software.",intermediate,3 Months,4.5,143.0,"Object-oriented programming,  functional programming,  I/O,  reflection,  concurrent programming,  Java modules","Basic programming concepts like variables, loops and conditionals.",none,Unknown,Unknown,Unknown,Unknown,https://www.udacity.com/course/java-programming-nanodegree--nd079
CID30966,Cloud DevOps Engineer,nanodegree,Companies are looking for talented DevOps engineers to remain competitive in this agile world. Enroll now to master skills like operationalizing infrastructure at scale and delivering applications and services at high velocity.,intermediate,4 Months,4.6,846.0,"AWS, Configuration Management with Ansible, Continuous Integration / Continuous Deployment, Microservices with Kubernetes, CloudFormation",Intermediate JavaScript,none,Unknown,Unknown,Unknown,Unknown,https://www.udacity.com/course/cloud-dev-ops-nanodegree--nd9991
CID93781,Data Architect,nanodegree,"Learn how to plan, design and implement enterprise data infrastructure solutions and create the blueprints for your organization’s data success.",advanced,4 Months,4.6,122.0,"Entity relationship diagrams,  Relational Data Design,  Online Analytical Processing,  Operational Data Stores,  Data Lake Architecture,  Data Governance
","Intermediate Python, SQL, and Basics of ETL/Data Pipelines",none,Unknown,Unknown,Unknown,Unknown,https://www.udacity.com/course/data-architect-nanodegree--nd038
CID27974,Data Analysis and Visualization with Microsoft Power BI,nanodegree,"Utilize Microsoft Power BI as a primary tool for data pre-processing, visualization, and analysis.",beginner,3 Months,4.7,256.0,"Power BI,  data visulations,  data modeling,  Extract-Transform-Load,  Data Analytics Expressions",Microsoft Excel,none,Unknown,Unknown,Unknown,Unknown,https://www.udacity.com/course/data-analysis-and-visualization-with-power-BI-nanodegree--nd331
CID78943,Natural Language Processing,nanodegree,"Learn the job-ready skills that progress computers to be able to understand, process, and respond to human language.",advanced,3 Months,4.5,525.0,"Machine Learning, Speech Recognition, Sentiment Analysis, Machine Translation, Part of Speech Tagging","Python, Statistics, Machine Learning, & Deep Learning","Amazon Alexa, IBM Watson",Unknown,Unknown,Unknown,Unknown,https://www.udacity.com/course/natural-language-processing-nanodegree--nd892
CID23891,Intro to Self-Driving Cars,nanodegree,This introductory program is the perfect way to start your journey into the future of transportation—flying cars.,intermediate,4 Months,4.6,806.0,"Computer Vision, Machine Learning, Vehicle Motion, Control",Programming & Mathematics,none,Unknown,Unknown,Unknown,Unknown,https://www.udacity.com/course/intro-to-self-driving-cars--nd113
CID87441,Full Stack JavaScript Developer,nanodegree,"Find success as a full stack developer by focusing on topics like UI, UX, APIs, server side business logic, persistence layers, and more.",intermediate,4 Months,4.7,89.0,"Creating an API,  Databases and SQL,  Node.js,  Angular,  TypeScript,  Deployment","HTML, CSS, Basic JavaScript, JSON",none,Unknown,Unknown,Unknown,Unknown,https://www.udacity.com/course/full-stack-javascript-developer-nanodegree--nd0067
CID72020,Introduction to Cybersecurity,nanodegree,"Get your start in the high growth field of cybersecurity by building foundational skills including evaluating, maintaining, and monitoring the security of computer systems.",beginner,4 Months,4.5,163.0,"Threat Assessment, Security Vulnerabilities, Compliance, Governance, Risk, Incident Response",Basic knowledge of network connectivity and OS fundamentals,SecurityScorecard,Unknown,Unknown,Unknown,Unknown,https://www.udacity.com/course/intro-to-cybersecurity-nanodegree--nd545
CID42388,Data Streaming,nanodegree,Learn how to stream data to unlock key insights in real-time.,advanced,2 Months,4.3,242.0,"Data Streaming, Spark, Kafka, Kafka Streaming, Spark Streaming","Intermediate Python, SQL, and experience with ETL",none,Unknown,Unknown,Unknown,Unknown,https://www.udacity.com/course/data-streaming-nanodegree--nd029
CID90577,Cloud Developer,nanodegree,Cloud development is the foundation for the new world of software development. Enroll now to build and deploy production-ready full stack apps at scale on AWS.,intermediate,4 Months,4.5,844.0,"AWS, Microservices, Serverless Architecture, Kubernetes",Intermediate JavaScript,none,Unknown,Unknown,Unknown,Unknown,https://www.udacity.com/course/cloud-developer-nanodegree--nd9990
CID73589,Intro to Machine Learning with TensorFlow,nanodegree,"Build a solid foundation in supervised, unsupervised, and deep learning. Then, use these skills to test and deploy machine learning models in a production environment.",intermediate,3 Months,4.7,529.0,"TensorFlow, Deep Learning, scikit-learn, Supervised Learning, Unsupervised Learning",Intermediate Python,"Kaggle, AWS",Unknown,Unknown,Unknown,Unknown,https://www.udacity.com/course/intro-to-machine-learning-with-tensorflow-nanodegree--nd230
CID71852,Sensor Fusion Engineer,nanodegree,"Learn to fuse lidar point clouds, radar signatures, and camera images using Kalman Filters to detect and track vehicles and pedestrians over time.",advanced,4 Months,4.7,301.0,"Perception, Lidar, Radar, Sensors, Computer Vision","Intermediate C++, Calculus, and Probability",Mercedes-Benz,Unknown,Unknown,Unknown,Unknown,https://www.udacity.com/course/sensor-fusion-engineer-nanodegree--nd313
CID37370,Predictive Analytics For Business,nanodegree,"Learn essential AI concepts including search, optimization, planning, pattern recognition, and more from experts like Peter Norvig and Sebastian Thrun.",beginner,3 Months,4.7,554.0,"Data Wrangling, Classification, A/B Testing, Forecasting, Segmentation","Algebra, Descriptive Statistics, and Excel",Alteryx,Unknown,Unknown,Unknown,Unknown,https://www.udacity.com/course/predictive-analytics-for-business-nanodegree--nd008t
CID58147,Intermediate JavaScript,nanodegree,"Master JavaScript, the most popular programming language in the world. Be equipped for advanced roles in web development, server-side application development, and desktop development.",intermediate,3 Months,4.5,161.0,"Functional Programming, DOM, Data Structures, Asynchronous Programming, Synchronous Programming",Basic JavaScript,none,Unknown,Unknown,Unknown,Unknown,https://www.udacity.com/course/intermediate-javascript-nanodegree--nd032
CID24864,Agile Software Development,nanodegree,"Get equipped with the skills you need to guide the delivery of high value products with top notch software development teams.
",beginner,3 Months,4.7,151.0,"Agile, Scrum, Kanban, XP, Minimum Viable Product",No Experience Required,ThoughtWorks,Unknown,Unknown,Unknown,Unknown,https://www.udacity.com/course/agile-software-development-nanodegree--nd144
CID09496,Intro to Machine Learning with PyTorch,nanodegree,"Build a solid foundation in supervised, unsupervised, and deep learning. Then, use these skills to test and deploy machine learning models in a production environment.",intermediate,3 Months,4.7,446.0,"Introduction to Machine Learning, Supervised Learning, Deep Learning, Unsupervised Learning",Intermediate Python,"Kaggle, AWS",Unknown,Unknown,Unknown,Unknown,https://www.udacity.com/course/intro-to-machine-learning-nanodegree--nd229
CID97717,AWS Cloud Architect,nanodegree,"Build confidence planning, designing, and creating high availability cloud infrastructure.",advanced,3 Months,4.6,277.0,"Cloud Infrastructure, Cloud Security, AWS, CloudFormation, High Availability Infrastructure, Serverless Computing","Experience with Cloud Computing, Programming, and AWS",none,Unknown,Unknown,Unknown,Unknown,https://www.udacity.com/course/aws-cloud-architect-nanodegree--nd063
CID26341,AI for Business Leaders,nanodegree,"Master the foundations of artificial intelligence so you can strategically implement machine learning technology in your organization, and leverage it for corporate growth.",intermediate,2 Months,4.6,124.0,"Artificial Intelligence, Machine Learning, Business Strategy, Data Labeling, Data Modeling","Statistics, Probability, and Business Experience",BMW,Unknown,Unknown,Unknown,Unknown,https://www.udacity.com/course/ai-for-business-leaders--nd054
CID77491,AI for Healthcare,nanodegree,Be at the forefront of the AI revolution in healthcare and transform patient outcomes by enabling enhanced medical decision-making powered by machine learning.,advanced,4 Months,4.6,145.0,"Artificial Intelligence, 2D Medical Imaging, 3D Medical Imaging, Electronic Health Record Data, Deep Learning, Wearable Device Data, Supervised Learning","Intermediate Python, and Experience with Machine Learning",none,Unknown,Unknown,Unknown,Unknown,https://www.udacity.com/course/ai-for-healthcare-nanodegree--nd320
CID01056,iOS Developer,nanodegree,"Master the Swift programming language, and create a portfolio of iOS apps for iPhone and iPad to showcase your skills!",beginner,6 Months,4.6,897.0,"Swift programming, Core Data, UIKit, iOS networking, app publishing, User interfaces, Local Persistence, APIs",No prior knowledge required,none,Unknown,Unknown,Unknown,Unknown,https://www.udacity.com/course/ios-developer-nanodegree--nd003
CID32065,Flying Car and Autonomous Flight Engineer,nanodegree,"Master job-ready autonomous flight software engineering skills as you tackle advanced challenges, write real code for real aircraft, and develop a systems understanding of the Flying Car full-stack.",advanced,6 Months,4.6,254.0,"3D Motion Planning, Controls, Estimation, Kalman Filters",Mathematics & Programming,none,Unknown,Unknown,Unknown,Unknown,https://www.udacity.com/course/flying-car-nanodegree--nd787
